{
  "i": "EGtyThM1rLBSMZ_ozM1uAnFvSfC0N1jaQ42aKU5sHYTGFD",
  "x": "EZllThM1rLBSMZ_ozM1uAnFvSfC0N1jaQ42aKU5sCZ5Q",
  "s": [
    {
      "qualifiedvLEIIssuervLEICredential": "EGtyThM1rLBSMZ_ozM1uAnFvSfC0N1jaQ42aKU5sHYTGFD"
    }
  ],
  "d": {
    "type": [
      "VerifiablePresentation",
      "LegalEntityEngagementContextRolevLEICredential"
    ],
    "LEI": "254900YH3ZCDPE1E5306",
    "personLegalName": "Anne Jones",
    "engagementContextRole": "Project Manager",
    "credentialStatus": "did:keri:EymRy7xMwsxUelUauaXtMxTfPAMPAI6FkekwlOjkggt",
    "issuanceDate": "2021-06-09T17:35:54.169967+00:00",
    "i": "ErmVM5JGLewHJrSqIuhwWktoIlfffh7sHIGAQvtcFSU"
  }
}
